{
  "contractVersion": "agentique.graphBlockBundle.v1",
  "bundleId": "bundle:review-flow",
  "graph": {
    "contractVersion": "agentique.agentGraphRuntime.v1",
    "graphId": "graph:review-flow",
    "title": "Review flow",
    "summary": "Descriptor-only graph metadata for public review.",
    "version": "1.0.0",
    "compatibility": "compatible",
    "blocks": [
      {
        "id": "block:input",
        "manifestRef": "manifest:input",
        "name": "Input block",
        "version": "1.0.0",
        "categories": ["input"],
        "compatibility": "compatible",
        "blockedReasons": [],
        "ports": [
          {
            "id": "prompt",
            "name": "Prompt",
            "direction": "output",
            "schemaRef": {
              "kind": "json-schema",
              "ref": "schema:prompt",
              "required": true
            },
            "credentialReferenceOnly": false
          }
        ]
      },
      {
        "id": "block:review",
        "manifestRef": "manifest:review",
        "name": "Review block",
        "version": "1.0.0",
        "categories": ["transform"],
        "compatibility": "compatible",
        "blockedReasons": [],
        "ports": [
          {
            "id": "prompt",
            "name": "Prompt",
            "direction": "input",
            "schemaRef": {
              "kind": "json-schema",
              "ref": "schema:prompt",
              "required": true
            },
            "credentialReferenceOnly": false
          },
          {
            "id": "result",
            "name": "Result",
            "direction": "output",
            "schemaRef": {
              "kind": "json-schema",
              "ref": "schema:result",
              "required": true
            },
            "credentialReferenceOnly": false
          }
        ]
      }
    ],
    "nodes": [
      {
        "id": "node:input",
        "blockId": "block:input",
        "label": "Input",
        "inputPorts": [],
        "outputPorts": ["prompt"],
        "inputSchemaRefs": [],
        "outputSchemaRefs": [
          {
            "kind": "json-schema",
            "ref": "schema:prompt",
            "required": true
          }
        ],
        "credentialReferences": [],
        "compatibility": "compatible"
      },
      {
        "id": "node:review",
        "blockId": "block:review",
        "label": "Review",
        "inputPorts": ["prompt"],
        "outputPorts": ["result"],
        "inputSchemaRefs": [
          {
            "kind": "json-schema",
            "ref": "schema:prompt",
            "required": true
          }
        ],
        "outputSchemaRefs": [
          {
            "kind": "json-schema",
            "ref": "schema:result",
            "required": true
          }
        ],
        "credentialReferences": [
          {
            "referenceId": "credential:provider",
            "provider": "agentique-vault",
            "scopeRefs": ["scope:model-read"],
            "valueIncluded": false
          }
        ],
        "compatibility": "compatible"
      }
    ],
    "edges": [
      {
        "id": "edge:input-review",
        "from": {
          "nodeId": "node:input",
          "portId": "prompt"
        },
        "to": {
          "nodeId": "node:review",
          "portId": "prompt"
        },
        "label": "prompt"
      }
    ],
    "publicProjection": {
      "allowedPublicFields": ["graphId", "title", "blocks.id", "nodes.id", "edges.id"],
      "forbiddenPublicFields": ["rawCommands", "credentialValues", "localAbsolutePaths", "runtimeAvailabilityClaims"],
      "noExecutionDisclosureRequired": true,
      "unsupportedRuntimeClaimsForbidden": true
    },
    "noExecution": {
      "rawCommandsIncluded": false,
      "packageManagersExecuted": false,
      "lifecycleHooksExecuted": false,
      "graphExecuted": false,
      "blockRuntimeLoaded": false,
      "networkRequestsPerformed": false,
      "filesystemAccessGranted": false,
      "schedulerStarted": false,
      "webhookReceiverStarted": false
    },
    "noOverclaim": {
      "localRunnerAvailable": false,
      "schedulerAvailable": false,
      "webhookExecutionAvailable": false,
      "credentialValuesAvailable": false,
      "automaticInstallAvailable": false,
      "externalServiceCertified": false
    }
  },
  "blockManifests": [
    {
      "contractVersion": "agentique.blockManifest.v1",
      "blockId": "block:review",
      "name": "Review block",
      "summary": "Static schema metadata for public graph review.",
      "version": "1.0.0",
      "categories": ["transform", "approval"],
      "compatibility": "compatible",
      "inputSchema": [
        {
          "id": "prompt",
          "label": "Prompt",
          "visibility": "standard",
          "schemaRef": {
            "kind": "json-schema",
            "ref": "schema:prompt",
            "required": true
          },
          "required": true,
          "credentialReferenceOnly": false
        }
      ],
      "outputSchema": [
        {
          "id": "result",
          "label": "Result",
          "visibility": "standard",
          "schemaRef": {
            "kind": "json-schema",
            "ref": "schema:result",
            "required": true
          },
          "required": true,
          "credentialReferenceOnly": false
        }
      ],
      "advancedFields": [],
      "dependencies": [],
      "discriminators": [],
      "credentialFields": [],
      "sensitiveAction": false,
      "fixtures": [
        {
          "fixtureId": "fixture:review",
          "inputSchemaRef": {
            "kind": "json-schema",
            "ref": "schema:prompt",
            "required": true
          },
          "outputSchemaRef": {
            "kind": "json-schema",
            "ref": "schema:result",
            "required": true
          },
          "hasInputFixture": true,
          "hasOutputFixture": true,
          "staticOnly": true
        }
      ],
      "lifecycle": {
        "state": "static-metadata",
        "hooks": []
      }
    }
  ],
  "lifecycle": {
    "transferKind": "import",
    "lifecycleState": "pending-import",
    "noAutomaticInstall": true,
    "noAutomaticExecution": true,
    "rollbackReadback": {
      "rollbackAvailable": true,
      "readbackStatus": "verified",
      "readbackDigest": "sha256:abcdef123456"
    }
  },
  "diagnostics": {
    "healthState": "healthy",
    "readinessState": "ready",
    "redacted": true,
    "noPrivateTelemetryLeakage": true
  },
  "safety": {
    "noExecution": true,
    "noInstall": true,
    "noNetwork": true,
    "noArchiveExtraction": true,
    "noUserConfigMutation": true,
    "noRuntimeClaim": true,
    "descriptorOnly": true
  }
}
